Pokemon,Item,Ability,Tera Type,Move 1,Move 2,Move 3,Move 4,Rank,Wins,Losses,Tournament
UrshifuRapidStrike ,Choice Scarf,Unseen Fist,Ghost, Surging Strikes, Close Combat, Uturn, Aqua Jet,61,9,6,North America International
Landorus ,Life Orb,Sheer Force,Steel, Earth Power, Sludge Bomb, Sandsear Storm, Protect,62,9,5,North America International
Iron Hands ,Assault Vest,Quark Drive,Water, Wild Charge, Drain Punch, Heavy Slam, Fake Out,62,9,5,North America International
Farigiraf ,Electric Seed,Armor Tail,Ground, Twin Beam, Foul Play, Trick Room, Helping Hand,62,9,5,North America International
Miraidon ,Choice Specs,Hadron Engine,Electric, Electro Drift, Volt Switch, Discharge, Draco Meteor,62,9,5,North America International
Grimmsnarl ,Light Clay,Prankster,Ground, Spirit Break, Light Screen, Reflect, Thunder Wave,62,9,5,North America International
Iron Bundle ,Focus Sash,Quark Drive,Ghost, FreezeDry, Icy Wind, Encore, Protect,62,9,5,North America International
Farigiraf ,Electric Seed,Armor Tail,Ground, Helping Hand, Tera Blast, Trick Room, Foul Play,63,9,6,North America International
Tornadus ,Focus Sash,Prankster,Ground, Bleakwind Storm, Tailwind, Taunt, Protect,63,9,6,North America International
UrsalunaBloodmoon ,Life Orb,Mind’s Eye,Normal, Blood Moon, Earth Power, Hyper Voice, Protect,63,9,6,North America International
ChiYu ,Choice Scarf,Beads of Ruin,Ground, Heat Wave, Overheat, Tera Blast, Snarl,63,9,6,North America International
Iron Hands ,Clear Amulet,Quark Drive,Fire, Ice Punch, Close Combat, Fake Out, Wild Charge,63,9,6,North America International
Miraidon ,Choice Specs,Hadron Engine,Electric, Draco Meteor, Discharge, Electro Drift, Volt Switch,63,9,6,North America International
Koraidon ,Clear Amulet,Orichalcum Pulse,Fire, Flare Blitz, Collision Course, Protect, Flame Charge,64,9,6,North America International
Flutter Mane ,Choice Specs,Protosynthesis,Fairy, Dazzling Gleam, Shadow Ball, Moonblast, Icy Wind,64,9,6,North America International
ChienPao ,Focus Sash,Sword of Ruin,Ghost, Icicle Crash, Taunt, Sucker Punch, Protect,64,9,6,North America International
Raging Bolt ,Life Orb,Protosynthesis,Grass, Thunderbolt, Draco Meteor, Thunderclap, Protect,64,9,6,North America International
Entei ,Assault Vest,Inner Focus,Normal, Extreme Speed, Sacred Fire, Snarl, Flare Blitz,64,9,6,North America International
ChiYu ,Choice Scarf,Beads of Ruin,Ghost, Dark Pulse, Overheat, Heat Wave, Snarl,64,9,6,North America International
Scream Tail ,Booster Energy,Protosynthesis,Grass, Protect, Dazzling Gleam, Disable, Encore,65,9,6,North America International
UrshifuRapidStrike ,Choice Scarf,Unseen Fist,Water, Aqua Jet, Close Combat, Surging Strikes, Uturn,65,9,6,North America International
Volcarona ,Covert Cloak,Flame Body,Water, Flamethrower, Struggle Bug, WillOWisp, Rage Powder,65,9,6,North America International
Rillaboom ,Assault Vest,Grassy Surge,Fire, Grassy Glide, Uturn, Wood Hammer, Fake Out,65,9,6,North America International
Terapagos ,Leftovers,Tera Shift,Stellar, Tera Starstorm, Flamethrower, Calm Mind, Protect,65,9,6,North America International
Incineroar ,Safety Goggles,Intimidate,Ghost, Fake Out, Parting Shot, Knock Off, Taunt,65,9,6,North America International
Terapagos ,Leftovers,Tera Shift,Stellar, Tera Starstorm, Earth Power, Calm Mind, Protect,66,9,6,North America International
Rillaboom ,Assault Vest,Grassy Surge,Fire, Wood Hammer, Grassy Glide, Uturn, Fake Out,66,9,6,North America International
UrshifuRapidStrike ,Choice Scarf,Unseen Fist,Water, Surging Strikes, Close Combat, Aqua Jet, Uturn,66,9,6,North America International
Flutter Mane ,Focus Sash,Protosynthesis,Fairy, Moonblast, Shadow Ball, Icy Wind, Taunt,66,9,6,North America International
Incineroar ,Safety Goggles,Intimidate,Ghost, Knock Off, Fake Out, WillOWisp, Parting Shot,66,9,6,North America International
Amoonguss ,Rocky Helmet,Regenerator,Water, Pollen Puff, Spore, Rage Powder, Protect,66,9,6,North America International
Tornadus ,Covert Cloak,Prankster,Dark, Protect, Tailwind, Scary Face, Bleakwind Storm,67,9,6,North America International
Amoonguss ,Rocky Helmet,Regenerator,Fairy, Rage Powder, Spore, Pollen Puff, Protect,67,9,6,North America International
Terapagos ,Choice Specs,Tera Shift,Stellar, Tera Starstorm, Dark Pulse, Earth Power, Hyper Beam,67,9,6,North America International
ChiYu ,Focus Sash,Beads of Ruin,Ghost, Heat Wave, Protect, Dark Pulse, Overheat,67,9,6,North America International
Flutter Mane ,Booster Energy,Protosynthesis,Fairy, Protect, Moonblast, Thunder Wave, Icy Wind,67,9,6,North America International
Iron Hands ,Assault Vest,Quark Drive,Grass, Fake Out, Drain Punch, Wild Charge, Heavy Slam,67,9,6,North America International
UrshifuRapidStrike ,Choice Scarf,Unseen Fist,Ghost, Surging Strikes, Close Combat, Uturn, Aqua Jet,68,9,6,North America International
Rillaboom ,Miracle Seed,Grassy Surge,Grass, Wood Hammer, Grassy Glide, Fake Out, Protect,68,9,6,North America International
Pelipper ,Rocky Helmet,Drizzle,Grass, Weather Ball, Hurricane, Wide Guard, Protect,68,9,6,North America International
ChienPao ,Focus Sash,Sword of Ruin,Ghost, Icicle Crash, Throat Chop, Sucker Punch, Protect,68,9,6,North America International
Zamazenta ,Rusted Shield,Dauntless Shield,Grass, Body Press, Heavy Slam, Wide Guard, Protect,68,9,6,North America International
Thundurus ,Covert Cloak,Prankster,Dark, Thunderbolt, Eerie Impulse, Taunt, Thunder Wave,68,9,6,North America International
Landorus ,Life Orb,Sheer Force,Fairy, Protect, Earth Power, Sludge Bomb, Sandsear Storm,69,9,6,North America International
UrshifuRapidStrike ,Choice Scarf,Unseen Fist,Ghost, Surging Strikes, Coaching, Close Combat, Uturn,69,9,6,North America International
Amoonguss ,Covert Cloak,Regenerator,Dark, Spore, Clear Smog, Rage Powder, Pollen Puff,69,9,6,North America International
Raging Bolt ,Assault Vest,Protosynthesis,Electric, Electroweb, Volt Switch, Thunderclap, Draco Meteor,69,9,6,North America International
Pelipper ,Focus Sash,Drizzle,Ghost, Hurricane, Weather Ball, Wide Guard, Helping Hand,69,9,6,North America International
CalyrexIce ,Clear Amulet,As One (Glastrier),Fire, Glacial Lance, Trick Room, High Horsepower, Protect,69,9,6,North America International
Terapagos ,Covert Cloak,Tera Shift,Stellar, Tera Starstorm, Earth Power, Calm Mind, Protect,70,9,6,North America International
Gholdengo ,Metal Coat,Good as Gold,Fairy, Make It Rain, Shadow Ball, Nasty Plot, Protect,70,9,6,North America International
OgerponWellspring ,Wellspring Mask,Water Absorb,Water, Ivy Cudgel, Horn Leech, Follow Me, Spiky Shield,70,9,6,North America International
Whimsicott ,Focus Sash,Prankster,Ghost, Moonblast, Tailwind, Encore, Protect,70,9,6,North America International
Iron Hands ,Assault Vest,Quark Drive,Grass, Drain Punch, Wild Charge, Heavy Slam, Fake Out,70,9,6,North America International
Incineroar ,Safety Goggles,Intimidate,Ghost, Flare Blitz, Knock Off, Parting Shot, Fake Out,70,9,6,North America International
Koraidon ,Clear Amulet,Orichalcum Pulse,Fire, Collision Course, Flare Blitz, Flame Charge, Protect,71,8,5,North America International
OgerponCornerstone ,Cornerstone Mask,Sturdy,Rock, Power Whip, Ivy Cudgel, Follow Me, Spiky Shield,71,8,5,North America International
Raging Bolt ,Assault Vest,Protosynthesis,Electric, Thunderclap, Draco Meteor, Electroweb, Volt Switch,71,8,5,North America International
Incineroar ,Safety Goggles,Intimidate,Ghost, WillOWisp, Knock Off, Parting Shot, Fake Out,71,8,5,North America International
Flutter Mane ,Focus Sash,Protosynthesis,Fairy, Moonblast, Icy Wind, Taunt, Protect,71,8,5,North America International
Gholdengo ,Leftovers,Good as Gold,Normal, Make It Rain, Shadow Ball, Nasty Plot, Protect,71,8,5,North America International
UrshifuRapidStrike ,Choice Scarf,Unseen Fist,Grass, Uturn, Aqua Jet, Close Combat, Surging Strikes,72,8,5,North America International
ChienPao ,Focus Sash,Sword of Ruin,Stellar, Protect, Sucker Punch, Sacred Sword, Ice Spinner,72,8,5,North America International
Archaludon ,Assault Vest,Stamina,Fairy, Electro Shot, Draco Meteor, Body Press, Flash Cannon,72,8,5,North America International
Kyogre ,Mystic Water,Drizzle,Grass, Protect, Origin Pulse, Ice Beam, Water Spout,72,8,5,North America International
Tornadus ,Covert Cloak,Prankster,Steel, Taunt, Tailwind, Rain Dance, Bleakwind Storm,72,8,5,North America International
Amoonguss ,Rocky Helmet,Regenerator,Fairy, Protect, Rage Powder, Pollen Puff, Spore,72,8,5,North America International
Ditto ,Focus Sash,Imposter,Ghost, Transform,,,,73,8,6,North America International
UrshifuRapidStrike ,Choice Scarf,Unseen Fist,Water, Surging Strikes, Close Combat, Uturn, Coaching,73,8,6,North America International
CalyrexIce ,Clear Amulet,As One (Glastrier),Normal, Glacial Lance, Swords Dance, Protect, High Horsepower,73,8,6,North America International
IndeedeeF ,Psychic Seed,Psychic Surge,Water, Follow Me, Psychic, Helping Hand, Trick Room,73,8,6,North America International
Raging Bolt ,Booster Energy,Protosynthesis,Electric, Thunderclap, Draco Meteor, Thunderbolt, Protect,73,8,6,North America International
Tornadus ,Covert Cloak,Prankster,Steel, Bleakwind Storm, Rain Dance, Tailwind, Taunt,73,8,6,North America International
Ditto ,Choice Scarf,Imposter,Ghost, Transform,,,,74,8,7,North America International
Urshifu ,Focus Sash,Unseen Fist,Dark, Wicked Blow, Close Combat, Sucker Punch, Detect,74,8,7,North America International
Iron Hands ,Assault Vest,Quark Drive,Water, Fake Out, Drain Punch, Wild Charge, Volt Switch,74,8,7,North America International
Amoonguss ,Covert Cloak,Regenerator,Fairy, Pollen Puff, Rage Powder, Protect, Spore,74,8,7,North America International
CalyrexIce ,Clear Amulet,As One (Glastrier),Fire, Trick Room, Glacial Lance, High Horsepower, Protect,74,8,7,North America International
Incineroar ,Safety Goggles,Intimidate,Ghost, Fake Out, Knock Off, Taunt, Parting Shot,74,8,7,North America International
Gyarados ,Sitrus Berry,Intimidate,Flying, Waterfall, Tera Blast, Dragon Dance, Protect,75,8,7,North America International
Miraidon ,Choice Specs,Hadron Engine,Electric, Electro Drift, Volt Switch, Draco Meteor, Discharge,75,8,7,North America International
Farigiraf ,Life Orb,Armor Tail,Ground, Psychic Noise, Hyper Voice, Trick Room, Protect,75,8,7,North America International
ChiYu ,Choice Scarf,Beads of Ruin,Ground, Flamethrower, Dark Pulse, Tera Blast, Snarl,75,8,7,North America International
Whimsicott ,Focus Sash,Prankster,Ghost, Moonblast, Tailwind, Encore, Protect,75,8,7,North America International
Iron Hands ,Assault Vest,Quark Drive,Water, Fake Out, Wild Charge, Drain Punch, Heavy Slam,75,8,7,North America International
Tornadus ,Covert Cloak,Prankster,Dark, Bleakwind Storm, Protect, Tailwind, Scary Face,76,8,7,North America International
UrshifuRapidStrike ,Safety Goggles,Unseen Fist,Water, Surging Strikes, Detect, Taunt, Close Combat,76,8,7,North America International
Raging Bolt ,Assault Vest,Protosynthesis,Grass, Thunderclap, Thunderbolt, Draco Meteor, Electroweb,76,8,7,North America International
ChiYu ,Choice Scarf,Beads of Ruin,Ground, Heat Wave, Tera Blast, Dark Pulse, Overheat,76,8,7,North America International
Smeargle ,Focus Sash,Moody,Ghost, Spore, Wide Guard, Fake Out, Follow Me,76,8,7,North America International
Terapagos ,Choice Specs,Tera Shift,Stellar, Hyper Beam, Earth Power, Tera Starstorm, Ice Beam,76,8,7,North America International
Whimsicott ,Focus Sash,Prankster,Ghost, Moonblast, Tailwind, Encore, Protect,77,8,7,North America International
Farigiraf ,Electric Seed,Armor Tail,Ground, Psychic Noise, Helping Hand, Trick Room, Protect,77,8,7,North America International
Miraidon ,Choice Specs,Hadron Engine,Electric, Volt Switch, Electro Drift, Draco Meteor, Discharge,77,8,7,North America International
Volcarona ,Leftovers,Flame Body,Dragon, Heat Wave, Bug Buzz, Quiver Dance, Protect,77,8,7,North America International
Iron Hands ,Assault Vest,Quark Drive,Water, Drain Punch, Fake Out, Wild Charge, Volt Switch,77,8,7,North America International
UrsalunaBloodmoon ,Life Orb,Mind’s Eye,Normal, Hyper Voice, Blood Moon, Earth Power, Protect,77,8,7,North America International
Koraidon ,Clear Amulet,Orichalcum Pulse,Fire, Collision Course, Flare Blitz, Flame Charge, Protect,78,8,4,North America International
Smeargle ,Focus Sash,Moody,Ground, Spore, Follow Me, Wide Guard, Fake Out,78,8,4,North America International
Raging Bolt ,Assault Vest,Protosynthesis,Electric, Dragon Pulse, Thunderclap, Weather Ball, Volt Switch,78,8,4,North America International
Tornadus ,Covert Cloak,Prankster,Dark, Bleakwind Storm, Tailwind, Taunt, Protect,78,8,4,North America International
Gholdengo ,Metal Coat,Good as Gold,Steel, Make It Rain, Shadow Ball, Nasty Plot, Protect,78,8,4,North America International
Flutter Mane ,Fairy Feather,Protosynthesis,Fairy, Moonblast, Dazzling Gleam, Shadow Ball, Protect,78,8,4,North America International
Pelipper ,Rocky Helmet,Drizzle,Grass, Weather Ball, Hurricane, Wide Guard, Protect,79,7,5,North America International
Incineroar ,Safety Goggles,Intimidate,Ghost, Fake Out, Knock Off, Taunt, Parting Shot,79,7,5,North America International
Grimmsnarl ,Light Clay,Prankster,Ghost, Spirit Break, Reflect, Light Screen, Thunder Wave,79,7,5,North America International
Lunala ,Leftovers,Shadow Shield,Fairy, Moongeist Beam, Moonblast, Calm Mind, Protect,79,7,5,North America International
Rillaboom ,Assault Vest,Grassy Surge,Fire, Fake Out, Grassy Glide, Wood Hammer, Uturn,79,7,5,North America International
UrshifuRapidStrike ,Choice Scarf,Unseen Fist,Ghost, Surging Strikes, Close Combat, Aqua Jet, Uturn,79,7,5,North America International
ChiYu ,Focus Sash,Beads of Ruin,Ghost, Overheat, Dark Pulse, Heat Wave, Protect,80,7,6,North America International
UrshifuRapidStrike ,Mystic Water,Unseen Fist,Water, Taunt, Surging Strikes, Close Combat, Detect,80,7,6,North America International
Iron Hands ,Assault Vest,Quark Drive,Fire, Fake Out, Drain Punch, Wild Charge, Heavy Slam,80,7,6,North America International
Terapagos ,Choice Specs,Tera Shift,Stellar, Tera Starstorm, Dark Pulse, Earth Power, Tri Attack,80,7,6,North America International
Flutter Mane ,Booster Energy,Protosynthesis,Fairy, Protect, Shadow Ball, Moonblast, Icy Wind,80,7,6,North America International
Grimmsnarl ,Light Clay,Prankster,Ghost, Thunder Wave, Foul Play, Reflect, Light Screen,80,7,6,North America International
ChiYu ,Choice Specs,Beads of Ruin,Ghost, Heat Wave, Dark Pulse, Overheat, Flamethrower,81,6,3,North America International
Grimmsnarl ,Light Clay,Prankster,Fire, Spirit Break, Thunder Wave, Light Screen, Reflect,81,6,3,North America International
Miraidon ,Life Orb,Hadron Engine,Electric, Electro Drift, Draco Meteor, Volt Switch, Protect,81,6,3,North America International
Iron Hands ,Assault Vest,Quark Drive,Water, Drain Punch, Wild Charge, Fake Out, Ice Punch,81,6,3,North America International
Farigiraf ,Electric Seed,Armor Tail,Water, Psychic, Foul Play, Helping Hand, Trick Room,81,6,3,North America International
Iron Bundle ,Focus Sash,Quark Drive,Ghost, FreezeDry, Icy Wind, Encore, Protect,81,6,3,North America International
Gholdengo ,Leftovers,Good as Gold,Water, Protect, Make It Rain, Shadow Ball, Nasty Plot,82,6,3,North America International
Rillaboom ,Miracle Seed,Grassy Surge,Fire, Wood Hammer, Uturn, Grassy Glide, Fake Out,82,6,3,North America International
Incineroar ,Safety Goggles,Intimidate,Ghost, Knock Off, WillOWisp, Parting Shot, Fake Out,82,6,3,North America International
Amoonguss ,Rocky Helmet,Regenerator,Fairy, Protect, Pollen Puff, Spore, Rage Powder,82,6,3,North America International
Kyogre ,Assault Vest,Drizzle,Grass, Origin Pulse, Ice Beam, Water Spout, Thunder,82,6,3,North America International
Thundurus ,Covert Cloak,Prankster,Dark, Wildbolt Storm, Eerie Impulse, Taunt, Thunder Wave,82,6,3,North America International
Gholdengo ,Rocky Helmet,Good as Gold,Normal, Make It Rain, Shadow Ball, Nasty Plot, Protect,83,6,3,North America International
OgerponCornerstone ,Cornerstone Mask,Sturdy,Rock, Ivy Cudgel, Power Whip, Follow Me, Spiky Shield,83,6,3,North America International
ChienPao ,Focus Sash,Sword of Ruin,Ghost, Protect, Ice Spinner, Lash Out, Sucker Punch,83,6,3,North America International
Zamazenta ,Rusted Shield,Dauntless Shield,Grass, Heavy Slam, Body Press, Wide Guard, Protect,83,6,3,North America International
Raging Bolt ,Assault Vest,Protosynthesis,Electric, Thunderbolt, Thunderclap, Draco Meteor, Electroweb,83,6,3,North America International
Whimsicott ,Covert Cloak,Prankster,Water, Light Screen, Moonblast, Encore, Tailwind,83,6,3,North America International
UrsalunaBloodmoon ,Life Orb,Mind’s Eye,Normal, Blood Moon, Hyper Voice, Earth Power, Protect,84,6,3,North America International
Iron Hands ,Assault Vest,Quark Drive,Water, Drain Punch, Wild Charge, Volt Switch, Fake Out,84,6,3,North America International
Miraidon ,Choice Specs,Hadron Engine,Electric, Electro Drift, Volt Switch, Discharge, Dragon Pulse,84,6,3,North America International
Farigiraf ,Electric Seed,Armor Tail,Fire, Helping Hand, Trick Room, Psychic Noise, Foul Play,84,6,3,North America International
Volcarona ,Leftovers,Flame Body,Dragon, Flamethrower, Bug Buzz, Quiver Dance, Protect,84,6,3,North America International
Whimsicott ,Focus Sash,Prankster,Ghost, Moonblast, Tailwind, Encore, Protect,84,6,3,North America International
Pelipper ,Focus Sash,Drizzle,Ghost, Hurricane, Weather Ball, Wide Guard, Helping Hand,85,6,3,North America International
Raging Bolt ,Booster Energy,Protosynthesis,Electric, Thunderbolt, Draco Meteor, Thunderclap, Protect,85,6,3,North America International
Incineroar ,Safety Goggles,Intimidate,Water, Knock Off, Fake Out, Taunt, Parting Shot,85,6,3,North America International
UrshifuRapidStrike ,Choice Scarf,Unseen Fist,Ghost, Surging Strikes, Close Combat, Coaching, Uturn,85,6,3,North America International
CalyrexIce ,Clear Amulet,As One (Glastrier),Fire, Glacial Lance, High Horsepower, Trick Room, Protect,85,6,3,North America International
Amoonguss ,Mental Herb,Regenerator,Fairy, Pollen Puff, Spore, Rage Powder, Protect,85,6,3,North America International
Incineroar ,Safety Goggles,Intimidate,Ghost, Fake Out, Knock Off, Taunt, Parting Shot,86,6,3,North America International
ChienPao ,Focus Sash,Sword of Ruin,Stellar, Icicle Crash, Sucker Punch, Throat Chop, Protect,86,6,3,North America International
Raging Bolt ,Assault Vest,Protosynthesis,Fairy, Electroweb, Draco Meteor, Thunderclap, Snarl,86,6,3,North America International
Zamazenta ,Rusted Shield,Dauntless Shield,Ghost, Body Press, Heavy Slam, Iron Defense, Protect,86,6,3,North America International
Rillaboom ,Clear Amulet,Grassy Surge,Grass, Fake Out, Wood Hammer, Grassy Glide, Uturn,86,6,3,North America International
Pelipper ,Covert Cloak,Drizzle,Dark, Weather Ball, Hurricane, Tailwind, Wide Guard,86,6,3,North America International
Terrakion ,Covert Cloak,Justified,Grass, Protect, Upper Hand, Sacred Sword, Rock Slide,87,6,3,North America International
Clefairy ,Eviolite,Friend Guard,Ground, Protect, Follow Me, After You, Helping Hand,87,6,3,North America International
Pawmot ,Focus Sash,Volt Absorb,Fairy, Protect, Revival Blessing, Close Combat, Double Shock,87,6,3,North America International
CalyrexShadow ,Choice Specs,As One (Spectrier),Normal, Pollen Puff, Shadow Ball, Expanding Force, Astral Barrage,87,6,3,North America International
IndeedeeF ,Rocky Helmet,Psychic Surge,Water, Draining Kiss, Follow Me, Imprison, Trick Room,87,6,3,North America International
Whimsicott ,King's Rock,Prankster,Ghost, Tailwind, Fling, Beat Up, Moonblast,87,6,3,North America International
Pelipper ,Focus Sash,Drizzle,Ghost, Weather Ball, Hurricane, Wide Guard, Tailwind,88,6,3,North America International
CalyrexIce ,Clear Amulet,As One (Glastrier),Ground, Glacial Lance, High Horsepower, Protect, Trick Room,88,6,3,North America International
Incineroar ,Safety Goggles,Intimidate,Water, Parting Shot, Knock Off, Fake Out, Helping Hand,88,6,3,North America International
Raging Bolt ,Assault Vest,Protosynthesis,Electric, Thunderbolt, Draco Meteor, Electroweb, Thunderclap,88,6,3,North America International
Amoonguss ,Rocky Helmet,Regenerator,Fairy, Pollen Puff, Spore, Protect, Rage Powder,88,6,3,North America International
UrshifuRapidStrike ,Choice Scarf,Unseen Fist,Ghost, Surging Strikes, Close Combat, Coaching, Uturn,88,6,3,North America International
Magmar ,Eviolite,Flame Body,Ghost, Follow Me, Acid Spray, Protect, Overheat,89,6,3,North America International
Sableye ,Focus Sash,Prankster,Normal, WillOWisp, Reflect, Fake Out, Encore,89,6,3,North America International
Thundurus ,Safety Goggles,Prankster,Dark, Thunder Wave, Eerie Impulse, Thunderbolt, Electric Terrain,89,6,3,North America International
Comfey ,Mental Herb,Triage,Fairy, Helping Hand, Draining Kiss, Floral Healing, Endure,89,6,3,North America International
Terapagos ,Covert Cloak,Tera Shift,Stellar, Calm Mind, Thunderbolt, Protect, Tera Starstorm,89,6,3,North America International
Rillaboom ,Assault Vest,Grassy Surge,Ground, Grassy Glide, Wood Hammer, High Horsepower, Fake Out,89,6,3,North America International
Miraidon ,Choice Specs,Hadron Engine,Electric, Electro Drift, Discharge, Volt Switch, Dragon Pulse,90,6,3,North America International
Volcarona ,Leftovers,Flame Body,Grass, Flamethrower, Bug Buzz, Quiver Dance, Protect,90,6,3,North America International
Farigiraf ,Electric Seed,Armor Tail,Fire, Psychic Noise, Foul Play, Helping Hand, Trick Room,90,6,3,North America International
Whimsicott ,Focus Sash,Prankster,Ghost, Moonblast, Tailwind, Encore, Protect,90,6,3,North America International
UrsalunaBloodmoon ,Life Orb,Mind’s Eye,Normal, Hyper Voice, Blood Moon, Earth Power, Protect,90,6,3,North America International
Iron Hands ,Assault Vest,Quark Drive,Water, Drain Punch, Wild Charge, Fake Out, Volt Switch,90,6,3,North America International
Rillaboom ,Assault Vest,Grassy Surge,Fire, Wood Hammer, Grassy Glide, Fake Out, Uturn,91,6,3,North America International
Tornadus ,Rocky Helmet,Prankster,Dark, Bleakwind Storm, Sunny Day, Protect, Tailwind,91,6,3,North America International
CalyrexShadow ,Covert Cloak,As One (Spectrier),Fairy, Astral Barrage, Draining Kiss, Protect, Nasty Plot,91,6,3,North America International
Clefairy ,Eviolite,Friend Guard,Grass, Sing, Follow Me, Protect, Helping Hand,91,6,3,North America International
ChiYu ,Safety Goggles,Beads of Ruin,Water, Heat Wave, Dark Pulse, Protect, Taunt,91,6,3,North America International
Mienshao ,Focus Sash,Inner Focus,Fighting, Close Combat, Feint, Fake Out, Wide Guard,91,6,3,North America International
Rillaboom ,Assault Vest,Grassy Surge,Fire, Grassy Glide, Wood Hammer, High Horsepower, Fake Out,92,6,3,North America International
Tornadus ,Focus Sash,Prankster,Dark, Bleakwind Storm, Sunny Day, Tailwind, Protect,92,6,3,North America International
Koraidon ,Clear Amulet,Orichalcum Pulse,Fire, Collision Course, Flare Blitz, Flame Charge, Protect,92,6,3,North America International
Walking Wake ,Life Orb,Protosynthesis,Water, Hydro Steam, Draco Meteor, Flamethrower, Protect,92,6,3,North America International
Gholdengo ,Metal Coat,Good as Gold,Normal, Make It Rain, Shadow Ball, Nasty Plot, Protect,92,6,3,North America International
Incineroar ,Safety Goggles,Intimidate,Ghost, Fake Out, WillOWisp, Knock Off, Parting Shot,92,6,3,North America International
Smeargle ,Focus Sash,Moody,Grass, Decorate, Fake Out, Spore, Follow Me,93,6,3,North America International
Annihilape ,Choice Scarf,Defiant,Grass, Final Gambit, Close Combat, Coaching, Shadow Claw,93,6,3,North America International
CalyrexIce ,Clear Amulet,As One (Glastrier),Fire, Protect, Trick Room, Glacial Lance, High Horsepower,93,6,3,North America International
UrsalunaBloodmoon ,Life Orb,Mind’s Eye,Ghost, Protect, Blood Moon, Earth Power, Hyper Voice,93,6,3,North America International
Farigiraf ,Sitrus Berry,Armor Tail,Ground, Hyper Voice, Psychic Noise, Helping Hand, Trick Room,93,6,3,North America International
Raging Bolt ,Assault Vest,Protosynthesis,Electric, Draco Meteor, Thunderclap, Thunderbolt, Electroweb,93,6,3,North America International
Primarina ,Leftovers,Liquid Voice,Fire, Moonblast, Hyper Voice, Calm Mind, Protect,94,6,3,North America International
Incineroar ,Safety Goggles,Intimidate,Water, Flare Blitz, Knock Off, Parting Shot, Fake Out,94,6,3,North America International
Grimmsnarl ,Light Clay,Prankster,Poison, Spirit Break, Misty Terrain, Light Screen, Reflect,94,6,3,North America International
Sinistcha ,Sitrus Berry,Hospitality,Normal, Matcha Gotcha, Shadow Ball, Trick Room, Protect,94,6,3,North America International
Zamazenta ,Rusted Shield,Dauntless Shield,Grass, Body Press, Heavy Slam, Iron Defense, Protect,94,6,3,North America International
TingLu ,Assault Vest,Vessel of Ruin,Fairy, Stomping Tantrum, Throat Chop, Ruination, Snarl,94,6,3,North America International
Whimsicott ,Focus Sash,Prankster,Ghost, Moonblast, Tailwind, Encore, Protect,95,6,3,North America International
Iron Hands ,Assault Vest,Quark Drive,Grass, Drain Punch, Ice Punch, Volt Switch, Fake Out,95,6,3,North America International
Miraidon ,Choice Specs,Hadron Engine,Electric, Electro Drift, Discharge, Volt Switch, Draco Meteor,95,6,3,North America International
Volcarona ,Leftovers,Flame Body,Dragon, Flamethrower, Bug Buzz, Quiver Dance, Protect,95,6,3,North America International
Farigiraf ,Electric Seed,Armor Tail,Ground, Foul Play, Psychic, Trick Room, Helping Hand,95,6,3,North America International
Okidogi ,Wide Lens,Guard Dog,Normal, Gunk Shot, Drain Punch, Knock Off, Protect,95,6,3,North America International
Entei ,Assault Vest,Inner Focus,Normal, Sacred Fire, Stomping Tantrum, Extreme Speed, Snarl,96,6,3,North America International
Raging Bolt ,Magnet,Protosynthesis,Electric, Thunderbolt, Thunderclap, Draco Meteor, Protect,96,6,3,North America International
