Pokemon,Item,Ability,Tera Type,Move 1,Move 2,Move 3,Move 4,Rank,Wins,Losses,Tournament
ChienPao ,Focus Sash,Sword of Ruin,Ghost, Ice Spinner, Sacred Sword, Sucker Punch, Protect,112,6,3,Europe International
Incineroar ,Clear Amulet,Intimidate,Grass, Flare Blitz, Parting Shot, Fake Out, Knock Off,113,6,3,Europe International
Flutter Mane ,Choice Specs,Protosynthesis,Fairy, Moonblast, Dazzling Gleam, Shadow Ball, Power Gem,113,6,3,Europe International
UrsalunaBloodmoon ,Life Orb,Mind’s Eye,Normal, Blood Moon, Hyper Voice, Earth Power, Protect,113,6,3,Europe International
Raging Bolt ,Booster Energy,Protosynthesis,Electric, Thunderclap, Protect, Draco Meteor, Electroweb,113,6,3,Europe International
Farigiraf ,Sitrus Berry,Armor Tail,Fairy, Psychic, Dazzling Gleam, Trick Room, Helping Hand,113,6,3,Europe International
OgerponWellspring ,Wellspring Mask,Water Absorb,Water, Ivy Cudgel, Horn Leech, Follow Me, Spiky Shield,113,6,3,Europe International
ChienPao ,Focus Sash,Sword of Ruin,Ghost, Ice Spinner, Lash Out, Ice Shard, Protect,114,6,3,Europe International
Scizor ,Life Orb,Technician,Dragon, Bullet Punch, Close Combat, Bug Bite, Protect,114,6,3,Europe International
Pelipper ,Rocky Helmet,Drizzle,Steel, Hurricane, Weather Ball, Tailwind, Protect,114,6,3,Europe International
Amoonguss ,Sitrus Berry,Regenerator,Fairy, Spore, Rage Powder, Pollen Puff, Sludge Bomb,114,6,3,Europe International
Archaludon ,Assault Vest,Stamina,Grass, Flash Cannon, Draco Meteor, Electro Shot, Body Press,114,6,3,Europe International
UrshifuRapidStrike ,Choice Scarf,Unseen Fist,Grass, Surging Strikes, Close Combat, Aqua Jet, Uturn,114,6,3,Europe International
Flutter Mane ,Choice Specs,Protosynthesis,Fairy, Dazzling Gleam, Moonblast, Shadow Ball, Icy Wind,115,6,3,Europe International
Iron Crown ,Booster Energy,Quark Drive,Water, Expanding Force, Tachyon Cutter, Tera Blast, Protect,115,6,3,Europe International
OgerponWellspring ,Wellspring Mask,Water Absorb,Water, Ivy Cudgel, Horn Leech, Spiky Shield, Follow Me,115,6,3,Europe International
IndeedeeF ,Rocky Helmet,Psychic Surge,Fairy, Imprison, Trick Room, Helping Hand, Follow Me,115,6,3,Europe International
ChiYu ,Focus Sash,Beads of Ruin,Ghost, Heat Wave, Dark Pulse, Snarl, Protect,115,6,3,Europe International
Tornadus ,Covert Cloak,Prankster,Steel, Bleakwind Storm, Icy Wind, Tailwind, Taunt,115,6,3,Europe International
Dragonite ,Life Orb,Inner Focus,Normal, Extreme Speed, Stomping Tantrum, Ice Spinner, Protect,116,6,3,Europe International
Porygon2 ,Eviolite,Download,Ghost, Tera Blast, Ice Beam, Recover, Trick Room,116,6,3,Europe International
Kingambit ,Assault Vest,Defiant,Fairy, Iron Head, Assurance, Low Kick, Sucker Punch,116,6,3,Europe International
OgerponWellspring ,Wellspring Mask,Water Absorb,Water, Ivy Cudgel, Power Whip, Follow Me, Spiky Shield,116,6,3,Europe International
Gouging Fire ,Booster Energy,Protosynthesis,Grass, Heat Crash, Breaking Swipe, Howl, Sunny Day,116,6,3,Europe International
Flutter Mane ,Choice Specs,Protosynthesis,Fairy, Moonblast, Dazzling Gleam, Shadow Ball, Misty Terrain,116,6,3,Europe International
OgerponWellspring ,Wellspring Mask,Water Absorb,Water, Ivy Cudgel, Wood Hammer, Follow Me, Spiky Shield,117,6,3,Europe International
ChienPao ,Focus Sash,Sword of Ruin,Stellar, Ice Spinner, Sucker Punch, Sacred Sword, Protect,117,6,3,Europe International
Incineroar ,Assault Vest,Intimidate,Grass, Fake Out, Flare Blitz, Knock Off, Uturn,117,6,3,Europe International
Raging Bolt ,Booster Energy,Protosynthesis,Electric, Thunderbolt, Dragon Pulse, Thunderclap, Protect,117,6,3,Europe International
Gholdengo ,Life Orb,Good as Gold,Steel, Make It Rain, Shadow Ball, Nasty Plot, Protect,117,6,3,Europe International
Dragonite ,Choice Band,Inner Focus,Normal, Extreme Speed, Outrage, Stomping Tantrum, Aqua Jet,117,6,3,Europe International
Raging Bolt ,Assault Vest,Protosynthesis,Fairy, Thunderbolt, Draco Meteor, Thunderclap, Snarl,118,6,3,Europe International
Roaring Moon ,Booster Energy,Protosynthesis,Flying, Acrobatics, Knock Off, Dragon Dance, Protect,118,6,3,Europe International
OgerponWellspring ,Wellspring Mask,Water Absorb,Water, Ivy Cudgel, Wood Hammer, Follow Me, Spiky Shield,118,6,3,Europe International
Amoonguss ,Sitrus Berry,Regenerator,Fairy, Sludge Bomb, Pollen Puff, Spore, Rage Powder,118,6,3,Europe International
Incineroar ,Safety Goggles,Intimidate,Ghost, Flare Blitz, Knock Off, Fake Out, Parting Shot,118,6,3,Europe International
Flutter Mane ,Choice Specs,Protosynthesis,Fairy, Moonblast, Shadow Ball, Dazzling Gleam, Perish Song,118,6,3,Europe International
Grimmsnarl ,Light Clay,Prankster,Steel, Spirit Break, Thunder Wave, Reflect, Light Screen,119,6,3,Europe International
OgerponWellspring ,Wellspring Mask,Water Absorb,Water, Ivy Cudgel, Horn Leech, Swords Dance, Spiky Shield,119,6,3,Europe International
Okidogi ,Assault Vest,Guard Dog,Water, Gunk Shot, Drain Punch, High Horsepower, Upper Hand,119,6,3,Europe International
Roaring Moon ,Booster Energy,Protosynthesis,Flying, Knock Off, Acrobatics, Tailwind, Protect,119,6,3,Europe International
Gholdengo ,Sitrus Berry,Good as Gold,Dragon, Make It Rain, Shadow Ball, Nasty Plot, Protect,119,6,3,Europe International
Entei ,Choice Band,Inner Focus,Fairy, Sacred Fire, Extreme Speed, Stone Edge, Stomping Tantrum,119,6,3,Europe International
Incineroar ,Safety Goggles,Intimidate,Water, Flare Blitz, Parting Shot, Fake Out, Knock Off,120,6,3,Europe International
Landorus ,Life Orb,Sheer Force,Steel, Sludge Bomb, Earth Power, Substitute, Protect,120,6,3,Europe International
Tornadus ,Focus Sash,Prankster,Ghost, Bleakwind Storm, Tailwind, Rain Dance, Protect,120,6,3,Europe International
Amoonguss ,Sitrus Berry,Regenerator,Fairy, Sludge Bomb, Rage Powder, Protect, Spore,120,6,3,Europe International
UrshifuRapidStrike ,Choice Scarf,Unseen Fist,Water, Surging Strikes, Aqua Jet, Close Combat, Uturn,120,6,3,Europe International
Flutter Mane ,Booster Energy,Protosynthesis,Fairy, Dazzling Gleam, Shadow Ball, Moonblast, Protect,120,6,3,Europe International
Incineroar ,Sitrus Berry,Intimidate,Ghost, Flare Blitz, Taunt, Parting Shot, Fake Out,121,6,3,Europe International
UrshifuRapidStrike ,Choice Scarf,Unseen Fist,Fire, Surging Strikes, Close Combat, Fire Punch, Uturn,121,6,3,Europe International
Dusclops ,Eviolite,Pressure,Fairy, Night Shade, WillOWisp, Haze, Trick Room,121,6,3,Europe International
Raging Bolt ,Booster Energy,Protosynthesis,Bug, Dragon Pulse, Thunderclap, Calm Mind, Protect,121,6,3,Europe International
Ursaluna ,Flame Orb,Guts,Ghost, Facade, Headlong Rush, Substitute, Protect,121,6,3,Europe International
Rillaboom ,Assault Vest,Grassy Surge,Fire, Wood Hammer, Grassy Glide, Uturn, Fake Out,121,6,3,Europe International
OgerponWellspring ,Wellspring Mask,Water Absorb,Water, Ivy Cudgel, Horn Leech, Follow Me, Spiky Shield,122,6,3,Europe International
Landorus ,Life Orb,Sheer Force,Poison, Earth Power, Sludge Bomb, Substitute, Protect,122,6,3,Europe International
Gholdengo ,Leftovers,Good as Gold,Fairy, Make It Rain, Shadow Ball, Nasty Plot, Protect,122,6,3,Europe International
Iron Bundle ,Booster Energy,Quark Drive,Poison, Icy Wind, FreezeDry, Encore, Protect,122,6,3,Europe International
Incineroar ,Sitrus Berry,Intimidate,Ghost, Flare Blitz, Knock Off, Fake Out, Parting Shot,122,6,3,Europe International
Urshifu ,Focus Sash,Unseen Fist,Dark, Wicked Blow, Sucker Punch, Close Combat, Detect,122,6,3,Europe International
Dondozo ,Rocky Helmet,Unaware,Grass, Wave Crash, Order Up, Earthquake, Protect,123,6,3,Europe International
Tornadus ,Focus Sash,Prankster,Ghost, Tailwind, Bleakwind Storm, Icy Wind, Protect,123,6,3,Europe International
Glimmora ,Power Herb,Toxic Debris,Grass, Meteor Beam, Sludge Bomb, Mortal Spin, Spiky Shield,123,6,3,Europe International
Urshifu ,Choice Band,Unseen Fist,Dark, Wicked Blow, Sucker Punch, Close Combat, Uturn,123,6,3,Europe International
Tatsugiri ,Life Orb,Commander,Steel, Draco Meteor, Dragon Pulse, Muddy Water, Protect,123,6,3,Europe International
Flutter Mane ,Booster Energy,Protosynthesis,Fairy, Moonblast, Taunt, Icy Wind, Protect,123,6,3,Europe International
Rillaboom ,Assault Vest,Grassy Surge,Poison, Wood Hammer, Grassy Glide, High Horsepower, Fake Out,124,6,3,Europe International
ChienPao ,Focus Sash,Sword of Ruin,Stellar, Icicle Crash, Sucker Punch, Sacred Sword, Protect,124,6,3,Europe International
Dragonite ,Choice Band,Inner Focus,Normal, Extreme Speed, Aerial Ace, Stomping Tantrum, Aqua Jet,124,6,3,Europe International
OgerponHearthflame ,Hearthflame Mask,Mold Breaker,Fire, Ivy Cudgel, Wood Hammer, Stomping Tantrum, Spiky Shield,124,6,3,Europe International
Raging Bolt ,Leftovers,Protosynthesis,Fairy, Dragon Pulse, Thunderclap, Calm Mind, Protect,124,6,3,Europe International
NinetalesAlola ,Light Clay,Snow Warning,Fire, Blizzard, Aurora Veil, Encore, Protect,124,6,3,Europe International
Urshifu ,Focus Sash,Unseen Fist,Stellar, Wicked Blow, Close Combat, Sucker Punch, Detect,125,6,3,Europe International
OgerponHearthflame ,Hearthflame Mask,Mold Breaker,Fire, Ivy Cudgel, Wood Hammer, Stomping Tantrum, Spiky Shield,125,6,3,Europe International
Iron Hands ,Clear Amulet,Quark Drive,Fire, Fake Out, Close Combat, Heavy Slam, Wild Charge,125,6,3,Europe International
Farigiraf ,Mental Herb,Armor Tail,Fire, Dazzling Gleam, Psychic, Helping Hand, Trick Room,125,6,3,Europe International
UrsalunaBloodmoon ,Life Orb,Mind’s Eye,Normal, Blood Moon, Earth Power, Hyper Voice, Protect,125,6,3,Europe International
Tornadus ,Rocky Helmet,Prankster,Steel, Bleakwind Storm, Tailwind, Taunt, Protect,125,6,3,Europe International
Talonflame ,Life Orb,Gale Wings,Flying, Brave Bird, Tailwind, Protect, Flare Blitz,126,6,3,Europe International
Armarouge ,Power Herb,Flash Fire,Psychic, Heat Wave, Expanding Force, Meteor Beam, Trick Room,126,6,3,Europe International
Dondozo ,Leftovers,Unaware,Fairy, Wave Crash, Tera Blast, Protect, Earthquake,126,6,3,Europe International
Tatsugiri ,Choice Specs,Commander,Water, Muddy Water, Draco Meteor, Hydro Pump, Dragon Pulse,126,6,3,Europe International
MausholdFour ,Wide Lens,Technician,Normal, Feint, Follow Me, Protect, Population Bomb,126,6,3,Europe International
IndeedeeF ,Rocky Helmet,Psychic Surge,Grass, Dazzling Gleam, Helping Hand, Trick Room, Follow Me,126,6,3,Europe International
Incineroar ,Safety Goggles,Intimidate,Ghost, Fake Out, Flare Blitz, Parting Shot, Knock Off,127,6,3,Europe International
Landorus ,Life Orb,Sheer Force,Poison, Earth Power, Sludge Bomb, Substitute, Protect,127,6,3,Europe International
Amoonguss ,Rocky Helmet,Regenerator,Fairy, Spore, Rage Powder, Pollen Puff, Protect,127,6,3,Europe International
UrshifuRapidStrike ,Mystic Water,Unseen Fist,Grass, Surging Strikes, Close Combat, Aqua Jet, Detect,127,6,3,Europe International
Roaring Moon ,Booster Energy,Protosynthesis,Flying, Acrobatics, Knock Off, Dragon Dance, Protect,127,6,3,Europe International
Porygon2 ,Eviolite,Download,Poison, Ice Beam, Tera Blast, Recover, Trick Room,127,6,3,Europe International
Whimsicott ,Covert Cloak,Prankster,Fire, Tailwind, Charm, Light Screen, Moonblast,128,6,3,Europe International
ChienPao ,Focus Sash,Sword of Ruin,Stellar, Protect, Ice Spinner, Sucker Punch, Sacred Sword,128,6,3,Europe International
OgerponWellspring ,Wellspring Mask,Water Absorb,Water, Spiky Shield, Follow Me, Ivy Cudgel, Horn Leech,128,6,3,Europe International
Glimmora ,Power Herb,Toxic Debris,Grass, Spiky Shield, Meteor Beam, Sludge Bomb, Earth Power,128,6,3,Europe International
Dragonite ,Choice Band,Inner Focus,Normal, Extreme Speed, Outrage, Aerial Ace, Stomping Tantrum,128,6,3,Europe International
Entei ,Assault Vest,Inner Focus,Ghost, Sacred Fire, Extreme Speed, Snarl, Stomping Tantrum,128,6,3,Europe International
Landorus ,Life Orb,Sheer Force,Steel, Protect, Substitute, Sludge Bomb, Earth Power,129,6,3,North America International
Flutter Mane ,Choice Specs,Protosynthesis,Fairy, Moonblast, Dazzling Gleam, Shadow Ball, Power Gem,129,6,3,North America International
Rillaboom ,Clear Amulet,Grassy Surge,Fire, Fake Out, Grassy Glide, Wood Hammer, Taunt,129,6,3,North America International
Gouging Fire ,Booster Energy,Protosynthesis,Fairy, Burning Bulwark, Heat Crash, Howl, Breaking Swipe,129,6,3,North America International
Kingambit ,Black Glasses,Defiant,Dragon, Kowtow Cleave, Sucker Punch, Swords Dance, Protect,129,6,3,North America International
OgerponWellspring ,Wellspring Mask,Water Absorb,Water, Ivy Cudgel, Horn Leech, Spiky Shield, Follow Me,129,6,3,North America International
OgerponWellspring ,Wellspring Mask,Water Absorb,Water, Ivy Cudgel, Spiky Shield, Horn Leech, Follow Me,130,6,3,North America International
LandorusTherian ,Choice Scarf,Intimidate,Flying, Stomping Tantrum, Rock Slide, Uturn, Tera Blast,130,6,3,North America International
Flutter Mane ,Pixie Plate,Protosynthesis,Fairy, Moonblast, Taunt, Protect, Dazzling Gleam,130,6,3,North America International
Gouging Fire ,Booster Energy,Protosynthesis,Fairy, Burning Bulwark, Howl, Breaking Swipe, Heat Crash,130,6,3,North America International
Kingambit ,Assault Vest,Defiant,Fairy, Kowtow Cleave, Iron Head, Low Kick, Sucker Punch,130,6,3,North America International
Rillaboom ,Sitrus Berry,Grassy Surge,Ghost, Wood Hammer, Uturn, Grassy Glide, Fake Out,130,6,3,North America International
Raging Bolt ,Assault Vest,Protosynthesis,Fairy, Thunderclap, Electroweb, Draco Meteor, Snarl,131,6,3,North America International
Skeledirge ,Safety Goggles,Unaware,Fairy, Torch Song, Shadow Ball, WillOWisp, Slack Off,131,6,3,North America International
Urshifu ,Focus Sash,Unseen Fist,Dark, Wicked Blow, Close Combat, Sucker Punch, Detect,131,6,3,North America International
OgerponWellspring ,Wellspring Mask,Water Absorb,Water, Ivy Cudgel, Horn Leech, Follow Me, Spiky Shield,131,6,3,North America International
Landorus ,Life Orb,Sheer Force,Poison, Earth Power, Sludge Bomb, Imprison, Protect,131,6,3,North America International
Tornadus ,Covert Cloak,Prankster,Steel, Bleakwind Storm, Taunt, Tailwind, Icy Wind,131,6,3,North America International
ChienPao ,Focus Sash,Sword of Ruin,Stellar, Sucker Punch, Icicle Crash, Sacred Sword, Protect,132,6,3,North America International
ArcanineHisui ,Choice Band,Intimidate,Normal, Extreme Speed, Flare Blitz, Rock Slide, Head Smash,132,6,3,North America International
UrshifuRapidStrike ,Choice Scarf,Unseen Fist,Water, Uturn, Close Combat, Aqua Jet, Surging Strikes,132,6,3,North America International
Ogerpon ,Rocky Helmet,Defiant,Grass, Spiky Shield, Ivy Cudgel, Follow Me, Stomping Tantrum,132,6,3,North America International
Farigiraf ,Sitrus Berry,Armor Tail,Fire, Hyper Voice, Psychic, Trick Room, Helping Hand,132,6,3,North America International
UrsalunaBloodmoon ,Life Orb,Mind’s Eye,Normal, Blood Moon, Hyper Voice, Earth Power, Protect,132,6,3,North America International
NinetalesAlola ,Light Clay,Snow Warning,Fire, Blizzard, Icy Wind, Aurora Veil, Protect,133,6,3,North America International
Tatsugiri ,Focus Sash,Commander,Stellar, Muddy Water, Draco Meteor, Protect, Taunt,133,6,3,North America International
Glimmora ,Power Herb,Toxic Debris,Grass, Mortal Spin, Meteor Beam, Sludge Bomb, Spiky Shield,133,6,3,North America International
Articuno ,Icicle Plate,Snow Cloak,Ice, Blizzard, FreezeDry, Protect, Roost,133,6,3,North America International
Dondozo ,Leftovers,Unaware,Grass, Wave Crash, Earthquake, Order Up, Protect,133,6,3,North America International
Roaring Moon ,Booster Energy,Protosynthesis,Flying, Acrobatics, Knock Off, Tailwind, Protect,133,6,3,North America International
Amoonguss ,Rocky Helmet,Regenerator,Dark, Spore, Rage Powder, Sludge Bomb, Pollen Puff,134,6,3,North America International
Incineroar ,Sitrus Berry,Intimidate,Grass, Flare Blitz, Knock Off, Parting Shot, Fake Out,134,6,3,North America International
Flutter Mane ,Choice Specs,Protosynthesis,Fairy, Moonblast, Dazzling Gleam, Shadow Ball, Helping Hand,134,6,3,North America International
Farigiraf ,Throat Spray,Armor Tail,Fairy, Hyper Voice, Psychic Noise, Trick Room, Protect,134,6,3,North America International
Roaring Moon ,Clear Amulet,Protosynthesis,Poison, Knock Off, Breaking Swipe, Dragon Dance, Protect,134,6,3,North America International
Torkoal ,Charcoal,Drought,Fire, Eruption, Helping Hand, Overheat, Protect,134,6,3,North America International
Flutter Mane ,Booster Energy,Protosynthesis,Fairy, Moonblast, Icy Wind, Taunt, Protect,135,6,3,North America International
Glimmora ,Power Herb,Toxic Debris,Grass, Sludge Bomb, Meteor Beam, Spiky Shield, Earth Power,135,6,3,North America International
Gastrodon ,Leftovers,Storm Drain,Poison, Earth Power, Protect, Yawn, Ice Beam,135,6,3,North America International
Corviknight ,Safety Goggles,Mirror Armor,Fire, Brave Bird, Bulk Up, Iron Head, Roost,135,6,3,North America International
Urshifu ,Focus Sash,Unseen Fist,Dark, Wicked Blow, Sucker Punch, Close Combat, Detect,135,6,3,North America International
Entei ,Assault Vest,Inner Focus,Normal, Sacred Fire, Snarl, Stomping Tantrum, Extreme Speed,135,6,3,North America International
Landorus ,Life Orb,Sheer Force,Steel, Earth Power, Sludge Bomb, Taunt, Protect,136,6,3,North America International
ChienPao ,Focus Sash,Sword of Ruin,Ghost, Ice Spinner, Sucker Punch, Sacred Sword, Protect,136,6,3,North America International
Raging Bolt ,Assault Vest,Protosynthesis,Electric, Thunderclap, Electroweb, Thunderbolt, Dragon Pulse,136,6,3,North America International
OgerponWellspring ,Wellspring Mask,Water Absorb,Water, Spiky Shield, Ivy Cudgel, Follow Me, Horn Leech,136,6,3,North America International
ZapdosGalar ,Choice Scarf,Defiant,Ghost, Thunderous Kick, Uturn, Close Combat, Brave Bird,136,6,3,North America International
Incineroar ,Sitrus Berry,Intimidate,Ghost, Flare Blitz, WillOWisp, Fake Out, Parting Shot,136,6,3,North America International
UrsalunaBloodmoon ,Life Orb,Mind’s Eye,Normal, Blood Moon, Hyper Voice, Earth Power, Protect,137,6,3,North America International
IndeedeeF ,Psychic Seed,Psychic Surge,Fire, Follow Me, Alluring Voice, Helping Hand, Trick Room,137,6,3,North America International
Roaring Moon ,Booster Energy,Protosynthesis,Poison, Breaking Swipe, Knock Off, Tailwind, Protect,137,6,3,North America International
OgerponHearthflame ,Hearthflame Mask,Mold Breaker,Fire, Ivy Cudgel, Swords Dance, Wood Hammer, Spiky Shield,137,6,3,North America International
Hatterene ,Covert Cloak,Magic Bounce,Fairy, Trick Room, Expanding Force, Dazzling Gleam, Protect,137,6,3,North America International
UrshifuRapidStrike ,Assault Vest,Unseen Fist,Grass, Surging Strikes, Close Combat, Ice Spinner, Aqua Jet,137,6,3,North America International
Landorus ,Life Orb,Sheer Force,Poison, Earth Power, Sludge Bomb, Substitute, Protect,138,6,3,North America International
UrshifuRapidStrike ,Choice Scarf,Unseen Fist,Water, Surging Strikes, Close Combat, Ice Spinner, Uturn,138,6,3,North America International
Rillaboom ,Assault Vest,Grassy Surge,Fire, Fake Out, Wood Hammer, Grassy Glide, Uturn,138,6,3,North America International
Incineroar ,Sitrus Berry,Intimidate,Ghost, Fake Out, Parting Shot, Knock Off, WillOWisp,138,6,3,North America International
OgerponHearthflame ,Hearthflame Mask,Mold Breaker,Fire, Ivy Cudgel, Grassy Glide, Swords Dance, Spiky Shield,138,6,3,North America International
Raging Bolt ,Leftovers,Protosynthesis,Fairy, Dragon Pulse, Thunderclap, Calm Mind, Protect,138,6,3,North America International
OgerponWellspring ,Wellspring Mask,Water Absorb,Water, Ivy Cudgel, Horn Leech, Follow Me, Spiky Shield,139,6,3,North America International
Landorus ,Life Orb,Sheer Force,Poison, Earth Power, Sludge Bomb, Substitute, Protect,139,6,3,North America International
Raging Bolt ,Assault Vest,Protosynthesis,Fairy, Thunderbolt, Draco Meteor, Thunderclap, Snarl,139,6,3,North America International
Incineroar ,Safety Goggles,Intimidate,Ghost, Flare Blitz, Parting Shot, Taunt, Fake Out,139,6,3,North America International
Registeel ,Leftovers,Clear Body,Flying, Heavy Slam, Body Press, Iron Defense, Protect,139,6,3,North America International
Flutter Mane ,Booster Energy,Protosynthesis,Fairy, Moonblast, Taunt, Icy Wind, Protect,139,6,3,North America International
UrshifuRapidStrike ,Choice Scarf,Unseen Fist,Water, Surging Strikes, Aqua Jet, Close Combat, Uturn,140,6,3,North America International
Rillaboom ,Assault Vest,Grassy Surge,Fire, Grassy Glide, Wood Hammer, Uturn, Fake Out,140,6,3,North America International
Sylveon ,Leftovers,Pixilate,Fire, Hyper Voice, Tera Blast, Calm Mind, Protect,140,6,3,North America International
OgerponHearthflame ,Hearthflame Mask,Mold Breaker,Fire, Ivy Cudgel, Grassy Glide, Swords Dance, Spiky Shield,140,6,3,North America International
Incineroar ,Sitrus Berry,Intimidate,Ghost, Fake Out, Flare Blitz, Throat Chop, Parting Shot,140,6,3,North America International
Landorus ,Life Orb,Sheer Force,Steel, Earth Power, Sludge Bomb, Substitute, Protect,140,6,3,North America International
Urshifu ,Focus Sash,Unseen Fist,Dark, Wicked Blow, Close Combat, Sucker Punch, Detect,141,6,3,North America International
Farigiraf ,Throat Spray,Armor Tail,Fairy, Hyper Voice, Psychic, Protect, Trick Room,141,6,3,North America International
Tornadus ,Covert Cloak,Prankster,Steel, Bleakwind Storm, Taunt, Tailwind, Sunny Day,141,6,3,North America International
ChiYu ,Choice Specs,Beads of Ruin,Fire, Heat Wave, Dark Pulse, Overheat, Snarl,141,6,3,North America International
OgerponWellspring ,Wellspring Mask,Water Absorb,Water, Ivy Cudgel, Wood Hammer, Spiky Shield, Follow Me,141,6,3,North America International
Flutter Mane ,Booster Energy,Protosynthesis,Fairy, Moonblast, Dazzling Gleam, Icy Wind, Protect,141,6,3,North America International
Iron Hands ,Assault Vest,Quark Drive,Water, Wild Charge, Drain Punch, Heavy Slam, Fake Out,142,6,3,North America International
Roaring Moon ,Booster Energy,Protosynthesis,Poison, Protect, Knock Off, Breaking Swipe, Tailwind,142,6,3,North America International
Heatran ,Leftovers,Flash Fire,Grass, Protect, Heat Wave, Earth Power, Substitute,142,6,3,North America International
Flutter Mane ,Choice Specs,Protosynthesis,Fairy, Moonblast, Shadow Ball, Dazzling Gleam, Power Gem,142,6,3,North America International
OgerponWellspring ,Wellspring Mask,Water Absorb,Water, Spiky Shield, Ivy Cudgel, Horn Leech, Follow Me,142,6,3,North America International
Farigiraf ,Sitrus Berry,Armor Tail,Steel, Protect, Psychic, Hyper Voice, Trick Room,142,6,3,North America International
Raging Bolt ,Booster Energy,Protosynthesis,Fairy, Protect, Calm Mind, Thunderclap, Dragon Pulse,143,6,3,North America International
UrshifuRapidStrike ,Mystic Water,Unseen Fist,Fire, Protect, Surging Strikes, Close Combat, Aqua Jet,143,6,3,North America International
Incineroar ,Shuca Berry,Intimidate,Ghost, Flare Blitz, Fake Out, Parting Shot, WillOWisp,143,6,3,North America International
Gholdengo ,Leftovers,Good as Gold,Fairy, Protect, Nasty Plot, Make It Rain, Shadow Ball,143,6,3,North America International
Rillaboom ,Assault Vest,Grassy Surge,Fire, Wood Hammer, Fake Out, Grassy Glide, Uturn,143,6,3,North America International
ChienPao ,Clear Amulet,Sword of Ruin,Fire, Protect, Sucker Punch, Icicle Crash, Sacred Sword,143,6,3,North America International
Flutter Mane ,Booster Energy,Protosynthesis,Fairy, Moonblast, Icy Wind, Taunt, Protect,144,6,3,North America International
Raging Bolt ,Assault Vest,Protosynthesis,Fairy, Thunderclap, Draco Meteor, Electroweb, Snarl,144,6,3,North America International
Urshifu ,Focus Sash,Unseen Fist,Dark, Wicked Blow, Close Combat, Sucker Punch, Protect,144,6,3,North America International
OgerponHearthflame ,Hearthflame Mask,Mold Breaker,Fire, Ivy Cudgel, Wood Hammer, Stomping Tantrum, Spiky Shield,144,6,3,North America International
Landorus ,Life Orb,Sheer Force,Steel, Earth Power, Sludge Bomb, Substitute, Protect,144,6,3,North America International
Rillaboom ,Meadow Plate,Grassy Surge,Fire, Wood Hammer, Grassy Glide, Fake Out, Uturn,144,6,3,North America International
Gouging Fire ,Booster Energy,Protosynthesis,Fairy, Heat Crash, Breaking Swipe, Howl, Burning Bulwark,145,6,3,North America International
ChienPao ,Focus Sash,Sword of Ruin,Stellar, Icicle Crash, Sucker Punch, Sacred Sword, Protect,145,6,3,North America International
Rillaboom ,Miracle Seed,Grassy Surge,Fire, Wood Hammer, Grassy Glide, Taunt, Fake Out,145,6,3,North America International
Kingambit ,Assault Vest,Defiant,Fairy, Kowtow Cleave, Iron Head, Sucker Punch, Low Kick,145,6,3,North America International
Landorus ,Life Orb,Sheer Force,Poison, Earth Power, Sludge Bomb, Substitute, Protect,145,6,3,North America International
OgerponWellspring ,Wellspring Mask,Water Absorb,Water, Ivy Cudgel, Horn Leech, Follow Me, Spiky Shield,145,6,3,North America International
Urshifu ,Focus Sash,Unseen Fist,Dark, Close Combat, Wicked Blow, Sucker Punch, Protect,146,6,3,North America International
Landorus ,Life Orb,Sheer Force,Poison, Earth Power, Sludge Bomb, Substitute, Protect,146,6,3,North America International
ChiYu ,Choice Specs,Beads of Ruin,Ghost, Dark Pulse, Heat Wave, Overheat, Snarl,146,6,3,North America International
Raging Bolt ,Assault Vest,Protosynthesis,Fairy, Thunderclap, Dragon Pulse, Electroweb, Snarl,146,6,3,North America International
OgerponWellspring ,Wellspring Mask,Water Absorb,Water, Horn Leech, Ivy Cudgel, Follow Me, Spiky Shield,146,6,3,North America International
Flutter Mane ,Booster Energy,Protosynthesis,Fairy, Moonblast, Dazzling Gleam, Icy Wind, Protect,146,6,3,North America International
Urshifu ,Focus Sash,Unseen Fist,Dark, Close Combat, Wicked Blow, Sucker Punch, Detect,147,6,3,North America International
Cresselia ,Rocky Helmet,Levitate,Ghost, Stored Power, Dazzling Gleam, Calm Mind, Moonlight,147,6,3,North America International
Flutter Mane ,Booster Energy,Protosynthesis,Fairy, Dazzling Gleam, Icy Wind, Taunt, Protect,147,6,3,North America International
